{
  "attribution": {
    "attributed_paths": 8,
    "coverage_pct": 80,
    "net_attributed": 8,
    "per_ecosystem": {
      "deb": 8
    },
    "syft_version": "1.45.1",
    "total_paths": 10
  },
  "capabilities": {
    "vex_export": false
  },
  "coverage": null,
  "findings": [
    {
      "classification": "loaded",
      "cve": "CVE-1",
      "ecosystem": "deb",
      "evidence": {
        "loaded": {
          "access": "x",
          "path": "/usr/sbin/app",
          "reason": "observed"
        },
        "reason": "observed"
      },
      "package": "app",
      "purl": "pkg:deb/debian/app@1",
      "severity": "High",
      "version": "1"
    },
    {
      "classification": "not_loaded",
      "cve": "CVE-2",
      "ecosystem": "deb",
      "evidence": {
        "not_loaded": {
          "coverage_score": 90,
          "observed_event_count": 100,
          "observed_path_count": 1,
          "profiling_duration_seconds": 86400,
          "statement": "not observed loading during the profiling window — this is not proof of unreachability."
        },
        "reason": "not loaded"
      },
      "package": "tar",
      "purl": "pkg:deb/debian/tar@1",
      "severity": "Medium",
      "version": "1"
    },
    {
      "classification": "unmatched",
      "cve": "CVE-3",
      "ecosystem": "npm",
      "evidence": {
        "reason": "unmatched"
      },
      "package": "leftpad",
      "purl": "pkg:npm/leftpad@1",
      "severity": "Low",
      "version": "1"
    }
  ],
  "footer": "Reachability classifications are bounded by the profiling window. A package marked not_loaded was not observed loading during the window — this is not proof of unreachability. See docs/known-limitations.md for the observational-window caveat and other limitations.",
  "header": {
    "coverage_score": 90,
    "deployment": "web",
    "duration_seconds": 86400,
    "findings_source": "trivy-import",
    "generated_at": "2026-01-02T00:00:01Z",
    "grype_version": "0.92.2",
    "image_digest": "sha256:cccccccccccccccccccccccccccccccccccccccccccccccccccccccccccccccc",
    "image_ref": "registry/web@sha256:cccccccccccccccccccccccccccccccccccccccccccccccccccccccccccccccc",
    "known_limitations_ref": "docs/known-limitations.md",
    "namespace": "acme",
    "observed_event_count": 100,
    "observed_path_count": 1,
    "platform": "linux/arm64",
    "profile_id": "1",
    "scanner": "trivy",
    "scanner_db_timestamp": "",
    "sensor_version": "test",
    "syft_version": "1.45.1",
    "window_end": "2026-01-02T00:00:00Z",
    "window_start": "2026-01-01T00:00:00Z"
  },
  "schema": "tracepod.dev/reachability-report",
  "schema_version": "1.0",
  "summary": {
    "indeterminate": 0,
    "loaded": 1,
    "not_loaded": 1,
    "total": 3,
    "unmatched": 1
  }
}
