{
  "schema": "tracepod.dev/reachability-report",
  "schema_version": "1.0",
  "header": {
    "image_ref": "registry.example/mixed@sha256:1111111111111111111111111111111111111111111111111111111111111111",
    "image_digest": "sha256:1111111111111111111111111111111111111111111111111111111111111111",
    "platform": "linux/arm64",
    "profile_id": "7",
    "namespace": "acme",
    "deployment": "mixed",
    "window_start": "2026-01-01T00:00:00Z",
    "window_end": "2026-01-01T01:00:00Z",
    "duration_seconds": 3600,
    "observed_path_count": 5,
    "observed_event_count": 42,
    "coverage_score": 80,
    "sensor_version": "v0.1.2",
    "syft_version": "1.45.1",
    "grype_version": "0.92.2",
    "scanner": "grype",
    "scanner_db_timestamp": "2026-01-01T00:00:00Z",
    "findings_source": "grype-scan",
    "generated_at": "2026-01-01T01:00:01Z",
    "known_limitations_ref": "KNOWN-LIMITATIONS.md"
  },
  "summary": {
    "total": 6,
    "loaded": 2,
    "not_loaded": 2,
    "indeterminate": 1,
    "unmatched": 1
  },
  "coverage": null,
  "attribution": {
    "syft_version": "1.45.1",
    "total_paths": 120,
    "attributed_paths": 110,
    "net_attributed": 100,
    "coverage_pct": 83.33,
    "per_ecosystem": {
      "deb": 95,
      "generic": 5
    }
  },
  "findings": [
    {
      "cve": "CVE-2026-0001",
      "severity": "Critical",
      "purl": "pkg:deb/debian/libssl@3.0.0",
      "package": "libssl",
      "version": "3.0.0",
      "ecosystem": "deb",
      "classification": "loaded",
      "evidence": {
        "reason": "observed",
        "loaded": {
          "reason": "observed",
          "path": "/usr/lib/aarch64-linux-gnu/libssl.so.3",
          "access": "x"
        }
      }
    },
    {
      "cve": "CVE-2026-0002",
      "severity": "High",
      "purl": "pkg:deb/debian/libxml2@2.9.0",
      "package": "libxml2",
      "version": "2.9.0",
      "ecosystem": "deb",
      "classification": "not_loaded",
      "evidence": {
        "reason": "in image, never loaded during the window",
        "not_loaded": {
          "profiling_duration_seconds": 3600,
          "observed_path_count": 5,
          "observed_event_count": 42,
          "coverage_score": 80,
          "statement": "not observed loading during the profiling window — this is not proof of unreachability."
        }
      }
    },
    {
      "cve": "CVE-2026-0003",
      "severity": "High",
      "purl": "pkg:npm/leftpad@1.0.0",
      "package": "leftpad",
      "version": "1.0.0",
      "ecosystem": "npm",
      "classification": "unmatched",
      "evidence": {
        "reason": "no image package owns this purl (scanner/inventory ecosystem mismatch)"
      }
    },
    {
      "cve": "CVE-2026-0004",
      "severity": "Medium",
      "purl": "pkg:deb/debian/zlib1g@1.2.13",
      "package": "zlib1g",
      "version": "1.2.13",
      "ecosystem": "deb",
      "classification": "loaded",
      "evidence": {
        "reason": "elf-closure",
        "loaded": {
          "reason": "elf-closure",
          "path": "/usr/lib/aarch64-linux-gnu/libz.so.1",
          "access": "x",
          "required_by": "/usr/bin/app"
        }
      }
    },
    {
      "cve": "CVE-2026-0005",
      "severity": "Low",
      "purl": "pkg:rpm/redhat/openssl@3.0",
      "package": "openssl",
      "version": "3.0",
      "ecosystem": "rpm",
      "classification": "indeterminate",
      "evidence": {
        "reason": "rpm ecosystem not resolvable on this image family"
      }
    },
    {
      "cve": "CVE-2026-0006",
      "severity": "Negligible",
      "purl": "pkg:deb/debian/bash@5.2.0",
      "package": "bash",
      "version": "5.2.0",
      "ecosystem": "deb",
      "classification": "not_loaded",
      "evidence": {
        "reason": "in image, never loaded during the window",
        "not_loaded": {
          "profiling_duration_seconds": 3600,
          "observed_path_count": 5,
          "observed_event_count": 42,
          "coverage_score": 80,
          "statement": "not observed loading during the profiling window — this is not proof of unreachability."
        }
      }
    }
  ],
  "capabilities": {
    "vex_export": false
  },
  "footer": "Reachability classifications are bounded by the profiling window. A package marked not_loaded was not observed loading during the window — this is not proof of unreachability. See KNOWN-LIMITATIONS.md for the observational-window caveat and other limitations."
}
